"pmid","title","abstract","journal","authors","mesh","pub_date"
34757956,"Nanofibrous drug delivery systems for breast cancer: a review.","Breast cancer is the most common type of cancer among women. Breast-conserving surgery (BCS) is becoming a preferred approach for treating non-invasive or early-stage breast cancer cases. However, local-regional recurrence (LRR) is one of the critical risk factors after BCS. As many as 10-20% of BCS cases may show LRR within 5 years and almost 50% within 10 years. Radiation therapy is one of the treatments used to prevent LRR after breast-conserving surgery. However, because of possible side-effects of radiation therapy, targeted drug delivery systems based on nanofibers loaded with anti-cancer drugs have been explored in recent years to control LRR after BCS. This paper aims to review different polymers and anti-cancer drugs used for developing nanofibrous drug delivery systems against other breast cancer cell lines. It was observed that the utilization of nanofibers scaffolds after mastectomy could decrease the recurrence of breast cancer cells to a great extent as these nanofibrous scaffolds release drugs in a sustained manner for a prolonged time. Besides, the side effects of chemotherapy on healthy cells could be avoided. To the best of our knowledge, no such review paper is available in the literature that focuses only on the nanofibers-based system for breast cancer therapy.","Nanotechnology","{""Hussain, Tanveer"",""Ramakrishna, Seeram"",""Abid, Sharjeel""}","{N/A}","2021-11"
34757957,"Biocompatibility of electrospun cell culture scaffolds made from balangu seed mucilage/PVA composites.","Synthesis of Balangu (","Nanotechnology","{""Allafchian, Alireza"",""Saeedi, Shiva"",""Jalali, Seyed Amir Hossein""}","{N/A}","2021-11"
34757958,"How should we model and evaluate breathing interplay effects in IMPT?","Breathing interplay effects in Intensity Modulated Proton Therapy (IMPT) arise from the interaction between target motion and the scanning beam. Assessing the detrimental effect of interplay and the clinical robustness of several mitigation techniques requires statistical evaluation procedures that take into account the variability of breathing during dose delivery. In this study, we present such a statistical method to model intra-fraction respiratory motion based on breathing signals and assess clinical relevant aspects related to the practical evaluation of interplay in IMPT such as how to model irregular breathing, how small breathing changes affect the final dose distribution, and what is the statistical power (number of different scenarios) required for trustworthy quantification of interplay effects. First, two data-driven methodologies to generate artificial patient-specific breathing signals are compared: a simple sinusoidal model, and a precise probabilistic deep learning model generating very realistic samples of patient breathing. Second, we investigate the highly fluctuating relationship between interplay doses and breathing parameters, showing that small changes in breathing period result in large local variations in the dose. Our results indicate that using a limited number of samples to calculate interplay statistics introduces a bigger error than using simple sinusoidal models based on patient parameters or disregarding breathing hysteresis during the evaluation. We illustrate the power of the presented statistical method by analyzing interplay robustness of 4DCT and Internal Target Volume (ITV) treatment plans for a 8 lung cancer patients, showing that, unlike 4DCT plans, even 33 fraction ITV plans systematically fail to fulfill robustness requirements.","Physics in medicine and biology","{""Pastor-Serrano, Oscar"",""Habraken, Steven"",""Lathouwers, Danny"",""Hoogeman, Mischa"",""Schaart, Dennis"",""Perkó, Zoltán""}","{N/A}","2021-11"
34757959,"Designing of a pH-activatable carbon dots as a luminescent nanoprobe for recognizing folate receptor-positive cancer cells.","During recent years, cancer has been recognized as a well-known disorder all over the world. One of the important factors to tackle this problem better than past decades is early diagnosis that takes into practice by state-of-the-art visual equipment for detection cancer cells. Herein, in this research, we synthesized carbon dots with pH-dependent behavior from a green source by hydrothermal method with high quantum yield and blue fluorescence. Folic acid-conjugated carbon dots by an efficient and optimal conjugation method were set upped which determined cancer cells visually. These synthesized and conjugated nanoparticles entered into the cancer cells more comprehensive than normal cells by receptor-mediated endocytosis and could distinguish cancer cells from normal ones by fluorescence imaging. Ultimately, synthesized nanoparticles in this research can be considered as an efficient fluorescent nanoprobe for cancer pre-diagnosis.","Nanotechnology","{""Rashidi, Elham"",""Esfandiari, Neda"",""Ranjbar, Zahra"",""Alvandi, Nikta"",""Fatahi, Zahra""}","{N/A}","2021-11"
34757960,"Immunologic Contributions Following Rotator Cuff Injury and Development of Cuff Tear Arthropathy.","Rotator cuff tear arthropathy (RCTA) describes a pattern of glenohumeral degenerative changes following chronic rotator cuff tears that is characterized by superior humeral head migration, erosion of the greater tuberosity of the humeral head, contouring of the coracoacromial arch to create a socket for the humeral head, and eventual glenohumeral arthritis. Acute and chronic inflammatory changes following rotator cuff tears are thought to contribute to cartilage damage, muscle fibrosis, and fatty infiltration in the glenohumeral joint. In vitro animal studies targeting various inflammatory modulators, including macrophages, insulin-like growth factor-I, and transforming growth factor-beta pathways, provide promising therapeutic targets to improve healing after rotator cuff tears. The role of platelet-rich plasma in the treatment and prevention of RCTA has been investigated, with conflicting results.","JBJS reviews","{""Nelson, Grant B"",""McMellen, Christopher J"",""Kolaczko, Jensen G"",""Millett, Peter J"",""Gillespie, Robert J"",""Su, Charles A""}","{N/A}","2021-11"
34757961,"Equitable Access to Research Opportunities in Plastic Surgery: Development of a Research Fellowship Database.","N/A","Plastic and reconstructive surgery","{""Zimmerman, Carrie E"",""Humphries, Laura S"",""Taylor, Jesse A""}","{N/A}","2021-12"
34757989,"A Peer-Led, Artificial Intelligence-Augmented Social Network Intervention to Prevent HIV Among Youth Experiencing Homelessness.","Youth experiencing homelessness (YEH) are at elevated risk of HIV/AIDS and disproportionately identify as racial, ethnic, sexual, and gender minorities. We developed a new peer change agent (PCA) HIV prevention intervention with 3 arms: (1) an arm using an artificial intelligence (AI) planning algorithm to select PCAs; (2) a popularity arm, the standard PCA approach, operationalized as highest degree centrality (DC); and (3) an observation-only comparison group. A total of 713 YEH were recruited from 3 drop-in centers in Los Angeles, CA. Youth consented and completed a baseline survey that collected self-reported data on HIV knowledge, condom use, and social network information. A quasi-experimental pretest/posttest design was used; 472 youth (66.5% retention at 1 month postbaseline) and 415 youth (58.5% retention at 3 months postbaseline) completed follow-up. In each intervention arm (AI and DC), 20% of youth was selected as PCAs and attended a 4-hour initial training, followed by 7 weeks of half-hour follow-up sessions. Youth disseminated messages promoting HIV knowledge and condom use. Using generalized estimating equation models, there was a significant reduction over time (P < 0.001) and a significant time by AI arm interaction (P < 0.001) for condomless anal sex act. There was a significant increase in HIV knowledge over time among PCAs in DC and AI arms. PCA models that promote HIV knowledge and condom use are efficacious for YEH. Youth are able to serve as a bridge between interventionists and their community. Interventionists should consider working with computer scientists to solve implementation problems.","Journal of acquired immune deficiency syndromes (1999)","{""Rice, Eric"",""Wilder, Bryan"",""Onasch-Vera, Laura"",""DiGuiseppi, Graham"",""Petering, Robin"",""Hill, Chyna"",""Yadav, Amulya"",""Lee, Sung-Jae"",""Tambe, Milind""}","{N/A}","2021-12"
34757962,"Selective Microvascular Tissue Transfection Using Minicircle DNA for Systemic Delivery of Human Coagulation Factor IX in a Rat Model Using a Therapeutic Flap.","Gene therapy is a promising treatment for protein deficiency disorders such as hemophilia B. However, low tissue selectivity and efficacy are limitations of systemic vector delivery. The authors hypothesized that selective transfection of rat superficial inferior epigastric artery flaps could provide systemic delivery of coagulation factor IX, preventing the need for systemic vector administration. Minicircle DNA containing green fluorescent protein, firefly luciferase, and human coagulation factor IX were created. Vector constructs were validated by transfecting adipose-derived stromal cells isolated from Wistar rat superficial inferior epigastric artery flaps and evaluating transgene expression by fluorescence microscopy, bioluminescence, and enzyme-linked immunosorbent assay. Minicircle DNA luciferase (10 and 30 g) was injected into murine (wild-type, C57/BL/6) inguinal fat pads (n = 3) and followed by in vivo bioluminescence imaging for 60 days. Wistar rat superficial inferior epigastric artery flaps were transfected with minicircle DNA human coagulation factor IX (n = 9) with plasma and tissue transgene expression measured by enzyme-linked immunosorbent assay at 2 and 4 weeks. Transfected adipose-derived stromal cells expressed green fluorescent protein for 30 days, luciferase for 43 days, and human coagulation factor IX (21.9  1.2 ng/ml) for 28 days in vitro. In vivo murine studies demonstrated dose-dependence between minicircle DNA delivery and protein expression. Ex vivo rat superficial inferior epigastric artery flap transfection with minicircle DNA human coagulation factor IX showed systemic transgene expression at 2 (266.6  23.4 ng/ml) and 4 weeks (290.1  17.1 ng/ml) compared to control tissue (p < 0.0001). Rat superficial inferior epigastric artery flap transfection using minicircle DNA human coagulation factor IX resulted in systemic transgene detection, suggesting that selective flap or angiosome-based tissue transfection may be explored as a treatment for systemic protein deficiency disorders such as hemophilia B.","Plastic and reconstructive surgery","{""Than, Peter A"",""Davis, Christopher R"",""Rennert, Robert C"",""Morrison, Shane D"",""Findlay, Michael W"",""Kay, Mark A"",""Gurtner, Geoffrey C""}","{N/A}","2021-11"
34757963,"Anesthesia in Total Shoulder Arthroplasty: A Systematic Review and Meta-Analysis.","For shoulder arthroplasty, regional anesthesia is safer when compared with general anesthesia. There is insufficient evidence to demonstrate the superiority of regional anesthesia with respect to pulmonary complications and hospital length of stay. Infiltration of the shoulder with local anesthetics offers no additional benefits compared with single-shot or continuous brachial plexus blocks for shoulder arthroplasty. There is high-quality evidence (Level I) demonstrating lower pain scores and lower perioperative opioid requirements after a continuous peripheral nerve block compared with a single-shot nerve block. However, catheter dislodgment and logistical issues with catheter insertion are impediments to the widespread usage of a continuous nerve block with an indwelling catheter. Liposomal bupivacaine is comparable with non-liposomal local anesthetic agents with respect to pain relief, the opioid-sparing effect, and adverse effects in the first 48 hours after total shoulder arthroplasty. Perioperative dexamethasone administration improves postoperative pain control, decreases perioperative opioid requirements, and reduces postoperative nausea.","JBJS reviews","{""Boin, Michael A"",""Mehta, Devan"",""Dankert, John"",""Umeh, Uchenna O"",""Zuckerman, Joseph D"",""Virk, Mandeep S""}","{N/A}","2021-11"
34757965,"Myocarditis After Administration of Messenger Ribonucleic Acid-1273 Vaccine.","N/A","American journal of therapeutics","{""Soos, Michael P"",""Ghareeb, George S"",""George, Varun"",""Rahman, Minhazur"",""Holmes, Katelyn"",""Madala, Mohan C"",""Sulaiman, Abdulbaset M"",""Burke, Peter T"",""Kichloo, Asim"",""Kanjwal, Khalil""}","{N/A}","2021-9"
34757966,"Romiplostim for SARS-CoV-2 Vaccine Induced Immune Thrombocytopenia.","N/A","American journal of therapeutics","{""Abuhelwa, Ziad"",""Ning, Ying"",""Abdulsattar, Waleed"",""Ghazaleh, Sami"",""Kahlon, Navkirat"",""Elsayed, Ahmed""}","{COVID-19,""COVID-19 Vaccines"",Humans,""Purpura, Thrombocytopenic, Idiopathic"",""Receptors, Fc"",""Recombinant Fusion Proteins"",SARS-CoV-2,Thrombopoietin}","2021-9"
34757964,"Pharmacological Management of Myasthenia Gravis: A Century of Expert Opinions in Cecil Textbook of Medicine.","Advances in drug therapy for myasthenia gravis have had a significant impact on the quality of life and work potential of a substantial majority of affected persons and has contributed to a remarkable decrease in the frequency and severity of complications, hospitalizations, and mortality. What are the milestones of the changes in the expert approach to the pharmacological management of myasthenia in the past century? To determine the changes in the experts' approach to the management of myasthenia gravis, as presented in a widely used textbook in the United States. The chapters presenting the management of myasthenia gravis in the 26 editions of Cecil Textbook of Medicine published from 1927 to 2020. Adequate feeding, absolute rest in bed, and ""tonics"" were the only interventions recommended for the care of patients with myasthenia gravis in 1927. Ephedrine and glycine were used in the early 1930s. Treatment with the anticholinesterases physostigmine and neostigmine was recommended in 1937, 3 years after Mary Walker discovered it in the United Kingdom. Immunosuppressant pharmacological interventions with prednisone and azathioprine have been considered the standard since 1975, and intravenous immune globulin was added to usual care in 1996. The newer immunosuppressant drugs mycophenolate, cyclosporine, and tacrolimus have expanded the arsenal since 2008, and the monoclonal antibodies rituximab and eculizumab have been mentioned in the textbooks published in 2012-2020. The first randomized clinical trial of drug therapy for myasthenia gravis was published in 1987. The pharmacological management of myasthenia gravis was revolutionized by the epiphany of an astute clinician in the 1930s. Immunosuppressant treatment was a logical step once the autoimmune nature of the condition was established. The major therapeutic advances highlight the values of empiricism and persistent attention to detail in treating relatively rare chronic disorders.","American journal of therapeutics","{""Manu, Peter"",""Rogozea, Liliana M"",""Roman-Filip, Corina""}","{""Expert Testimony"",Humans,""Myasthenia Gravis"",Prednisone,""Quality of Life"",Rituximab}","0-0"
34757967,"Treatment Challenges of ST-Segment Elevation Myocardial Infarction Within the Constraint of COVID-19 Pandemic.","N/A","American journal of therapeutics","{""Shereef, Hammam"",""Yassin, Ahmed S"",""Subahi, Ahmed"",""Ali, Omar""}","{COVID-19,Humans,Pandemics,""Percutaneous Coronary Intervention"",SARS-CoV-2,""ST Elevation Myocardial Infarction""}","0-0"
34757968,"Neoadjuvant Chemotherapy in Synchronous Bilateral Breast Cancer With Different HER2 Types.","N/A","American journal of therapeutics","{""Ma, Teng"",""Mao, Yan"",""Wang, Hai-Bo""}","{N/A}","0-0"
34758006,"Can small-sided games assess the training-induced aerobic adaptations in elite football players?","To investigate whether or not SSGs could be used to evaluate the aerobic fitness status and the longitudinal training-induced adaptations in football players. Additionally, the capacity of SSGs to recreate the official match demands was investigated. Twenty-five elite football players were monitored. Total distance (TD), high-speed running, very high-speed running, sprint and accelerations plus decelerations distance were measured during 20 SSGs formats and 25 official-matches; in SSGs, average heart rate was also collected. During submaximal Yo-Yo test, heart rate at peak exercise, heart rate post-60s recovery and rate of perceived exertion were collected. Coefficient of variation, interclass correlation-coefficient and correlation-coefficient analysis were used to calculate validity, reliability, construct validity and, internal and external responsiveness of SSGs demands. In SSGs, a small variability (~6.0%) with moderate reliability (~0.542 to ~0.663) was found in TD and heart rate, while a high variability (~20.8% to ~60.3%) with poor to moderate reliability (~0.358 to ~0.605) was observed in the other metrics; in submaximal Yo-Yo, heart rate showed small variability (~3.7%) with good reliability (~0.933 to ~0.916). The SSGs demands showed poor internal and external responsiveness (p>0.05) to the training-induced aerobic adaptations as assessed by submaximal Yo-Yo. The construct validity of SSGs showed overall large to very large correlations (r=0.53 to 0.90, p<0.05) between SSGs and official match demands across the season. SSGs should not replace standardized field tests to detect the training-induced aerobic adaptations. However, SSGs could be confidently used to recreate specific contextual factors in elite football players.","The Journal of sports medicine and physical fitness","{""Riboli, Andrea"",""Dellal, Alexandre"",""Esposito, Fabio"",""Coratella, Giuseppe""}","{N/A}","2021-11"
34760993,"Giant hepatic neuroendocrine tumor.","N/A","Hepatobiliary surgery and nutrition","{""Kim, Seong Hoon"",""Park, Jangho""}","{N/A}","2021-10"
34757971,"COVID-19 Vaccine Hesitancy Among PLWH in South India: Implications for Vaccination Campaigns.","The global effort to end the Severe Acute Respiratory Syndrome - Coronavirus 2 pandemic will depend on our ability to achieve a high uptake of the highly efficacious vaccines in all countries. India recently experienced an unprecedented transmission surge, likely fueled by a premature reopening, the highly transmissible delta variant, and low vaccination rates. Indian media have reported high degrees of vaccine hesitancy, which could interfere with efforts to prevent future surges, making it crucial to better understand the reasons for such reluctance in vulnerable populations, such as people living with HIV. We conducted telephone interviews with 438 people living with HIV who were participants in a longitudinal cohort, designed to examine and validate novel antiretroviral therapy ART adherence measures. Interviews were conducted in January and February 2021 and covered COVID-19-related questions on confidence in vaccine safety and efficacy, worries of vaccine side effects, trust in COVID-19 information from specific sources, and intent to get vaccinated. Over one-third of participants (38.4%, n = 168) met our definition of ""vaccine hesitant"" by reporting being either unlikely to get vaccinated at all or wanting to wait. Vaccine hesitancy was associated with lack of confidence in vaccine safety, concerns about side effects and efficacy, and distrust in common sources of vaccine-related information. These results highlight several challenges for vaccination efforts. Campaigns may benefit from using trusted sources, including antiretroviral therapy center staff, providing clear information about safety and efficacy and emphasizing the role of vaccines in preventing severe disease, hospitalizations and death, and the reduction of forward transmission to unvaccinated household members.","Journal of acquired immune deficiency syndromes (1999)","{""Ekstrand, Maria L"",""Heylen, Elsa"",""Gandhi, Monica"",""Steward, Wayne T"",""Pereira, Matilda"",""Srinivasan, Krishnamachari""}","{N/A}","2021-12"
34757969,"Prophylactic Administration of Recombinant Human Thrombopoietin in the Secondary Prevention of Thrombocytopenia Induced by XELOX Adjuvant Chemotherapy in Patients With Stage III Colorectal Cancer: Erratum.","N/A","American journal of therapeutics","{N/A}","{N/A}","0-0"
34757970,"Review of the Emerging Evidence Demonstrating the Efficacy of Ivermectin in the Prophylaxis and Treatment of COVID-19: Erratum.","N/A","American journal of therapeutics","{N/A}","{N/A}","0-0"
34757972,"Prevalence of COVID-19-Related Social Disruptions and Effects on Psychosocial Health in a Mixed-Serostatus Cohort of Men and Women.","This study describes prevention behavior and psychosocial health among people living with HIV (PLHIV) and HIV-negative people during the early wave of the coronavirus disease 2019 (COVID-19) pandemic in the United States. We assessed differences by HIV status and associations between social disruption and psychosocial health. A cross-sectional telephone/videoconference administered survey of 3411 PLHIV and HIV-negative participants in the Multicenter AIDS Cohort Study/WIHS Combined Cohort Study (MWCCS). An instrument combining new and validated measures was developed to assess COVID-19 prevention efforts, social disruptions (loss of employment, childcare, health insurance, and financial supports), experiences of abuse, and psychosocial health. Interviews were performed between April and June 2020. Associations between social disruptions and psychosocial health were explored using multivariable logistic regression, adjusting for sociodemographics and HIV status. Almost all (97.4%) participants reported COVID-19 prevention behavior; 40.1% participants reported social disruptions, and 34.3% reported health care appointment disruption. Men living with HIV were more likely than HIV-negative men to experience social disruptions (40.6% vs. 32.9%; P < 0.01), whereas HIV-negative women were more likely than women with HIV to experience social disruptions (51.1% vs. 39.8%, P < 0.001). Participants who experienced 2 social disruptions had significantly higher odds of depression symptoms [aOR = 1.32; 95% confidence interval (CI): 1.12 to 1.56], anxiety (aOR = 1.63; 95% CI: 1.17 to 2.27), and social support dissatisfaction (aOR = 1.81; 95% CI: 1.26 to 2.60). This study builds on emerging literature demonstrating the psychosocial health impact related to the COVID-19 pandemic by providing context specific to PLHIV. The ongoing pandemic requires structural and social interventions to decrease social disruption and address psychosocial health needs among the most vulnerable populations.","Journal of acquired immune deficiency syndromes (1999)","{""Friedman, M Reuel"",""Kempf, Mirjam-Colette"",""Benning, Lorie"",""Adimora, Adaora A"",""Aouizerat, Bradley"",""Cohen, Mardge H"",""Hatfield, Queen"",""Merenstein, Dan"",""Mimiaga, Matthew J"",""Plankey, Michael W"",""Sharma, Anjali"",""Sheth, Anandi N"",""Ramirez, Catalina"",""Stosor, Valentina"",""Wagner, Marc C E"",""Wilson, Tracey E"",""D Souza, Gypsyamber"",""Weiss, Deborah Jones""}","{N/A}","2021-12"
34757973,"Impact of the COVID-19 Pandemic on Use of HIV Care, Antiretroviral Therapy Adherence, and Viral Suppression: An Observational Cohort Study From Uganda.","Recent studies project thousands of additional AIDS-related deaths because of COVID-19-related disruptions in HIV care. However, the extent to which disruptions in care have materialized since the start of the pandemic is not well understood. We use electronic health records to investigate how the pandemic has affected clinic visits, patients' antiretroviral therapy (ART) supply, and viral suppression for a cohort of 14,632 HIV clients from a large HIV clinic in Kampala, Uganda. We complement this with an analysis of electronically measured longitudinal ART adherence data from a subcohort of 324 clients. Clinic visits decreased by more than 50% after a national lockdown started. The risk of patients running out of ART on a given day increased from 5% before the lockdown to 25% 3 months later (Relative Risk Ratio of 5.11, 95% confidence interval: 4.99 to 5.24) and remained higher than prelockdown 6 months later at 13% (Relative Risk Ratio of 2.60; 95% confidence interval: 2.52 to 2.70). There was no statistically significant change in electronically measured adherence or viral suppression. We document substantial gaps in HIV care after the start of the COVID-19 pandemic in Uganda. This suggests that measures to improve access should be explored as the pandemic persists. However, ART adherence was unaffected for the subcohort for whom we measured electronic adherence. This suggests that some clients may have stockpiles of ART tablets from previous prescriptions that allowed them to keep taking their medication even when they could not visit the clinic for ART refills.","Journal of acquired immune deficiency syndromes (1999)","{""Wagner, Zachary"",""Mukasa, Barbara"",""Nakakande, Josephine"",""Stecher, Chad"",""Saya, Uzaib"",""Linnemayr, Sebastian""}","{N/A}","2021-12"
