"pmid","title","abstract","journal","authors","mesh","pub_date"
34757974,"Brief Report: HCV Universal Test-and-Treat With Direct Acting Antivirals for Prisoners With or Without HIV: A Prison Health Care Workers-Led Model for HCV Microelimination in Thailand.","This study investigated the sustained virologic responses (SVRs) among prisoners with hepatitis C virus (HCV) using universal test-and-treat approach by prison health care workers in a central male prison in Thailand. A universal HCV screening was conducted in a maximum-security central prison (Klong Prem Central Prison) in Thailand. HCV RNA-confirmed prisoners were treated with generic sofosbuvir/velpatasvir by prison health care workers, regardless of their HCV genotypes and duration of prison sentences. We evaluated the SVR rates at 12 weeks after completing direct acting antivirals (DAA) treatment. A total of 68 prisoners with detectable HCV RNA received DAA treatment. The median age and duration of prison sentences were 44 years (interquartile range, 41-53) and 25 (interquartile range, 19-33) years, respectively. Twenty-five percentage of the participants was coinfected with HIV, and 6% of the participants was coinfected with hepatitis B virus. Among all prisoners who received DAA treatment, 20 (29%) had genotype (GT)-1a, 3 (4%) had GT-1b, 22 (32%) had GT-3a, 3 (4%) had GT-3b, and 7 (10%) had GT-6. Overall, improvements in liver biomarkers were seen after HCV treatment, and SVR was achieved in 97% of the participants with per-protocol analysis and in 90% of the participants with intention-to-treat analysis. HCV treatment using DAA among prisoners through universal test-and-treat approach led by prison health care workers is highly effective and safe, and such model can potentially help to facilitate the goals of HCV microelimination among prisoners in Thailand.","Journal of acquired immune deficiency syndromes (1999)","{""Supanan, Ruamthip"",""Han, Win Min"",""Harnpariphan, Weerakit"",""Ueaphongsukkit, Thornthun"",""Ubolyam, Sasiwimol"",""Sophonphan, Jiratchaya"",""Tangkijvanich, Pisit"",""Thanprasertsuk, Sombat"",""Avihingsanon, Anchalee"","", ""}","{N/A}","2021-12"
34757975,"Predictors of Transition to Frailty in Middle-Aged and Older People With HIV: A Prospective Cohort Study.","People with HIV (PWH) have increased frailty risk at younger ages compared with the general population. Multimorbidity is associated with frailty, yet effects of specific comorbidities on transition to frailty in PWH are unknown. Prospective study of 219 PWH age 45 years or older in the National NeuroAIDS Tissue Consortium. Frailty status was categorized using Fried frailty phenotype criteria. Comorbidities [bone disease, cardiovascular disease, cerebrovascular disease, liver disease, renal disease, diabetes, chronic obstructive pulmonary disease (COPD), hypertension, obesity, cancers, neuropsychiatric conditions] were assessed from longitudinal data. Associations between baseline comorbidities and transition to frailty within 30 months were analyzed using Kaplan-Meier and Cox regression models. Grip strength was assessed using mixed-effects models. At baseline, the median age was 61 years, 73% were male 98% were on antiretroviral therapy, 29% had 3 comorbidities, 27% were robust, and 73% were pre-frail. Cerebrovascular disease, diabetes, and COPD were independent predictors of transition to frailty within 30 months in models adjusted for age, sex, and multimorbidity (3 additional comorbidities) [hazard ratios (95% confidence intervals) 2.52 (1.29 to 4.93), 2.31 (1.12 to 4.76), and 1.82 (0.95 to 3.48), respectively]. Furthermore, cerebrovascular disease, diabetes, COPD, or liver disease co-occurring with multimorbidity was associated with substantially increased frailty hazards compared with multimorbidity alone (hazard ratios 4.75-7.46). Cerebrovascular disease was associated with decreased baseline grip strength (P = 0.0001), whereas multimorbidity, diabetes, and COPD were associated with declining grip strength (P < 0.10). In older PWH, cerebrovascular disease, diabetes, COPD, or liver disease co-occurring with multimorbidity is associated with substantially increased risk of becoming frail within 30 months. Interventions targeting these comorbidities may ameliorate frailty and age-related functional decline in PWH.","Journal of acquired immune deficiency syndromes (1999)","{""Lorenz, David R"",""Mukerji, Shibani S"",""Misra, Vikas"",""Uno, Hajime"",""Gelman, Benjamin B"",""Moore, David J"",""Singer, Elyse J"",""Morgello, Susan"",""Gabuzda, Dana""}","{N/A}","2021-12"
34757976,"""Zoom Dysmorphia"": A New Diagnosis in the COVID-19 Pandemic Era?","N/A","Plastic and reconstructive surgery","{""Gasteratos, Konstantinos"",""Spyropoulou, Georgia-Alexandra"",""Suess, Larry""}","{N/A}","2021-12"
34757977,"The Subacromial Bursa: Current Concepts Review.","The subacromial bursa is a distinct anatomic structure with distinct histologic features; it plays a critical role in the symptoms of the painful shoulder and in the local healing capacity of the rotator cuff tendon. Treatment of pain from bursitis of the subacromial bursa largely involves nonoperative interventions; however, operative treatment may be considered in certain instances. Preservation of the subacromial bursa should occur whenever possible given its intrinsic trophic and pluripotent factors, which have been shown to play important roles in rotator cuff tendon pathology.","JBJS reviews","{""Lanham, Nathan S"",""Swindell, Hasani W"",""Levine, William N""}","{N/A}","2021-11"
34757978,"Perioperative Management of Hepatitis C in Patients Undergoing Total Joint Arthroplasty.","A small yet growing subset of total joint arthroplasty (TJA) candidates are diagnosed with the hepatitis C virus (HCV), which is a known risk factor for periprosthetic joint infections. Given the poor outcomes associated with TJA infection, we recommend that candidates with HCV receive treatment prior to elective TJA. Interferon and ribavirin have historically been the standard treatment regimen for the management of HCV; however, adverse events and an inconsistent viral response have limited the efficacy of these therapies. The advent of direct-acting antivirals has resolved many of the issues associated with interferon and ribavirin regimens. Despite the success of direct-acting antivirals, there are still barriers to seeking treatment for TJA candidates with HCV. Many patients are faced with financial burdens, as insurance coverage of direct-acting antiviral therapies is inconsistent and varies by the patient's state of residence and specific treatment regimen. TJA candidates with HCV present health-care providers with a unique set of challenges, often encompassing economic, psychosocial, and complex medical concerns. Multidisciplinary care teams can be beneficial when caring for and optimizing this patient cohort. Management of HCV prior to elective TJA is associated with higher up-front costs but ultimately reduces long-term patient morbidity as well as associated direct and indirect health-care expenditures.","JBJS reviews","{""Ross, Phillip E"",""Young, Joseph R"",""O Connor, Casey M"",""Anoushiravani, Afshin A"",""DiCaprio, Matthew R""}","{N/A}","2021-11"
34757979,"Team Approach: Treatment of Shoulder Instability in Athletes.","Shoulder instability is a complex problem with a high rate of recurrence in athletes. Treatment of a first-time subluxation or dislocation event is controversial and depends on patient-specific factors as well as the identified pathology. Athletic trainers and physical therapists are an integral part of the treatment team of an in-season athlete who has experienced a shoulder instability event. Through comprehensive physiological assessments, these providers can effectively suggest modifications to the patient's training regimen as well as an appropriate rehabilitation program. Surgical intervention for shoulder stabilization should use an individualized approach for technique and timing. A team-based approach is necessary to optimize the care of this high-demand, high-risk population.","JBJS reviews","{""Wolf, Brian R"",""Tranovich, Meaghan A"",""Marcussen, Britt"",""Powell, Kammy J"",""Fleming, Jeffrey A"",""Shaffer, Michael A""}","{N/A}","2021-11"
34757980,"Social Media and Its Use in Orthopaedic Surgery Resident Education and Training.","The use of social media by health-care professionals and medical educators has been increasing over the past decade. Online social networks, professional networks, blogs, microblogs, forums, podcasts, and video-sharing platforms can be used effectively to communicate and engage with, as well as learn from, other residents and attending physicians worldwide. Social media platforms and other web-based applications can serve as powerful educational tools to enhance orthopaedic resident learning, collaboration, teaching, and case discussion.","JBJS reviews","{""Cole, Wendell W"",""Perez-Chaumont, Andre"",""Miskimin, Cadence"",""Mulcahey, Mary K""}","{N/A}","2021-11"
34758007,"Mid-term impact of mild-moderate COVID-19 on cardiorespiratory fitness in élite athletes.","Mid- and long-term sequelae of COVID-19 on cardiorespiratory fitness are unknown. Aim of the study was to assess the mid-term impact of mild-moderate COVID-19 on cardiorespiratory fitness evaluated by cardiopulmonary exercise testing (CPET) in lite athletes. 13 elite cross-country skiers with previous mild-moderate COVID-19 symptoms underwent CPET before resuming seasonal training (COVID athletes). 13 lite detrained cross-country skiers, matched for principal confounding factors, were taken as controls (control group). Resting peripheral oxygen saturation, pulmonary function test, echocardiography, bioelectrical impedance analysis and CPET (modified XELG2, Woodway, USA) were performed in all participants. Median recovery time in COVID athletes was 34 days (IQR 33-38 days). COVID athletes reached earlier the onset of the aerobic threshold (4'48"" vs 6'28"", R2=0.15, F=4.37, p<0.05)than controls, whereas the time to anaerobic threshold and maximal efforts did not significantly differ between groups. Oxygen consumption was lower at the aerobic threshold in COVID athletes than controls (VO2/kg 28.6 mL/min vs. 38.9 mL/min, R2=0.39, F=15.34, p<0.01), whereas no significant difference between groups was found both at the aerobic threshold and at peak exercise (all p<0.05). Findings from resting echocardiography and pulmonary function test were similar between the two groups. lite cross-country athletes, previously affected by mild-moderate COVID-19, reached earlier the aerobic threshold than controls, whereas the remaining CPET parameters did not differ between groups. Such changes were not associated with any detectable difference in resting pulmonary and cardiac examination. Subjects affected by mild-moderate COVID-19 may require a longer time course of re-adaptation to aerobic exercise.","The Journal of sports medicine and physical fitness","{""Anastasio, Fabio"",""LA Macchia, Tommaso"",""Rossi, Giulio"",""D Abbondanza, Marco"",""Curcio, Rosa"",""Vaudo, Gaetano"",""Pucci, Giacomo""}","{N/A}","2021-11"
34757981,"Outpatient Shoulder Arthroplasty Patient Selection, Patient Experience, and Cost Analyses: A Systematic Review.","The utilization of outpatient shoulder arthroplasty has been increasing. With increasing pressure to reduce costs, further underscored by the coronavirus (COVID-19) pandemic, many health-care organizations will move toward outpatient interventions to conserve inpatient resources. Although abundant literature has shown the advantages of outpatient total hip arthroplasty (THA) and total knee arthroplasty (TKA), there is a relative paucity describing outpatient shoulder arthroplasty. Thus, the purpose of this study was to summarize the peer-reviewed literature of outpatient shoulder arthroplasty with particular attention to patient selection, patient outcomes, and cost benefits. The PubMed, Cumulative Index to Nursing and Allied Health Literature (CINAHL), and Embase databases were queried according to Preferred Reporting Items for Systematic Reviews and Meta-Analyses (PRISMA) guidelines. All articles on outpatient shoulder arthroplasty were included. Data on patient selection, patient outcomes, and cost analyses were recorded. Patient outcomes, including complications, reoperations, and readmissions, were analyzed by weighted average. Twenty-three articles were included for analysis. There were 3 review articles and 20 studies with Level-III or IV evidence as assessed per The Journal of Bone & Joint Surgery Level of Evidence criteria. Patient selection was most often predicated on age <70 years, body mass index (BMI) <35 kg/m2, absence of active cardiopulmonary comorbidities, and presence of home support. Complications and readmissions were not common and either improved or were equivalent to those of inpatient shoulder arthroplasty. Patient satisfaction was high in studies of short-term and intermediate-term follow-up. The proposed cost benefit ranged from $747 to $53,202 with outpatient shoulder arthroplasty. The published literature to date supports outpatient shoulder arthroplasty as an effective, safe, and cost-reducing intervention with proper patient selection. Therapeutic Level IV. See Instructions for Authors for a complete description of levels of evidence.","JBJS reviews","{""O Donnell, Evan A"",""Fury, Matthew S"",""Maier, Stephen P"",""Bernstein, David N"",""Carrier, Robert E"",""Warner, Jon J P""}","{Aged,""Arthroplasty, Replacement, Shoulder"",COVID-19,Humans,Outpatients,""Patient Outcome Assessment"",""Patient Selection"",SARS-CoV-2}","2021-11"
34757983,"Congenital Myenteric Hypoganglionosis: Erratum.","N/A","The American journal of surgical pathology","{N/A}","{N/A}","2021-12"
34757982,"Impact of Next-generation Sequencing on Interobserver Agreement and Diagnosis of Spitzoid Neoplasms.","Atypical Spitzoid melanocytic tumors are diagnostically challenging. Many studies have suggested various genomic markers to improve classification and prognostication. We aimed to assess whether next-generation sequencing studies using the Tempus xO assay assessing mutations in 1711 cancer-related genes and performing whole transcriptome mRNA sequencing for structural alterations could improve diagnostic agreement and accuracy in assessing neoplasms with Spitzoid histologic features. Twenty expert pathologists were asked to review 70 consultation level cases with Spitzoid features, once with limited clinical information and again with additional genomic information. There was an improvement in overall agreement with additional genomic information. Most significantly, there was increase in agreement of the diagnosis of conventional melanoma from moderate (=0.470, SE=0.0105) to substantial (=0.645, SE=0.0143) as measured by an average Cohen . Clinical follow-up was available in all 70 cases which substantiated that the improved agreement was clinically significant. Among 3 patients with distant metastatic disease, there was a highly significant increase in diagnostic recognition of the cases as conventional melanoma with genomics (P<0.005). In one case, none of 20 pathologists recognized a tumor with BRAF and TERT promoter mutations associated with fatal outcome as a conventional melanoma when only limited clinical information was provided, whereas 60% of pathologists correctly diagnosed this case when genomic information was also available. There was also a significant improvement in agreement of which lesions should be classified in the Spitz category/WHO Pathway from an average Cohen  of 0.360 (SE=0.00921) to 0.607 (SE=0.0232) with genomics.","The American journal of surgical pathology","{""Benton, Sarah"",""Zhao, Jeffrey"",""Zhang, Bin"",""Bahrami, Armita"",""Barnhill, Raymond L"",""Busam, Klaus"",""Cerroni, Lorenzo"",""Cook, Martin G"",""de la Fouchardière, Arnaud"",""Elder, David E"",""Johansson, Iva"",""Landman, Gilles"",""Lazar, Alexander"",""LeBoit, Philip"",""Lowe, Lori"",""Massi, Daniela"",""Duncan, Lyn M"",""Messina, Jane"",""Mihic-Probst, Daniela"",""Mihm, Martin C"",""Piepkorn, Michael W"",""Schmidt, Birgitta"",""Scolyer, Richard A"",""Shea, Christopher R"",""Tetzlaff, Michael T"",""Tron, Victor A"",""Xu, Xiaowei"",""Yeh, Iwei"",""Yun, Sook Jung"",""Zembowicz, Artur"",""Gerami, Pedram""}","{Adult,""Biomarkers, Tumor"",Biopsy,""DNA Mutational Analysis"",Female,""High-Throughput Nucleotide Sequencing"",Humans,Male,""Middle Aged"",Mutation,""Nevus, Epithelioid and Spindle Cell"",""Observer Variation"",""Predictive Value of Tests"",""Reproducibility of Results"",""Skin Neoplasms""}","2021-12"
34757986,"Addressing Health Disparities in HIV: Introduction to the Special Issue.","Racial and ethnic minority, sexual and gender minority, and low-income people have historically experienced poorer health outcomes and poorer social conditions that lead to poorer health outcomes (social determinants of health) than nonminority people in the United States. To eliminate these health disparities, intentional and targeted interventions that address the needs and preferences of diverse populations are needed. To address disparities, the California HIV/AIDS Research Program focused their funding resources tightly on communities facing elevated HIV incidence or prevalence. This special issue describes interventions that aimed to increase linkage to and engagement in HIV-specific prevention or medical care, each uniquely tailored to the needs of an identified California population with disparate HIV-related health outcomes and each for implementation at a specific stage of the HIV prevention and care continuum.","Journal of acquired immune deficiency syndromes (1999)","{""Lightfoot, Marguerita"",""Milburn, Norweeta"",""Loeb Stanga, Lisa""}","{N/A}","2021-12"
34757987,"We are Family: A Feasibility and Acceptability Study of an HIV Prevention Intervention With the House Ball and Gay Family Communities.","Black and Latinx sexual minority youth are disproportionately affected by HIV. The House Ball and gay family communities encompass sexual and ethnic minority youth who form chosen families that promote protective HIV-related health behaviors. We conducted a small-scale trial of the We Are Family intervention, leveraging these existing social dynamics to address HIV. From September 2018 to September 2019, we enrolled N = 118 for baseline and 6-month follow-up assessments. Eligible participants were 18 years or older, San Francisco Bay Area residents, members of a house or gay family or ball attendees in the past year, smartphone users, and sexually active. The intervention included one 2-hour in-person group session, community-level events, a mobile health app, and a dedicated service provider. Ninety-seven percent of our participants were people of color, 94% were retained through follow-up. 73% attended at least 1 group session, 100% used the mobile health app, and 56% attended a community-level event. Modest changes were observed baseline to follow-up: among all participants, any condomless anal intercourse past 3 months (74.6%-66.7%, P = 0.064); among HIV-negative participants (N = 82) HIV testing past 6 months (80.7%-87.2%, P = 0.166); among HIV-positive participants (N = 34) receiving HIV primary care past 6 months (64.5%-78.8%, P = 0.139), and adherent to ART past 30 days (22.6%-28.1%, P = 0.712). 86% would be willing to refer a friend to the app, and 65% found the app to be personally relevant. We Are Family reaches and retains its target population, is feasible, acceptable, and shows promise for improving HIV-related health behavior.","Journal of acquired immune deficiency syndromes (1999)","{""Arnold, Emily A"",""Saberi, Parya"",""Wong, Jeffrey O"",""Pollack, Lance M"",""Neilands, Torsten B"",""Benjamin, Michael"",""Lockett, Gloria"",""Kegeles, Susan M""}","{N/A}","2021-12"
34757988,"Structural Syndemics and Antiretroviral Medication Adherence Among Black Sexual Minority Men Living With HIV.","Although HIV antiretroviral treatment (ART) access and uptake have increased among racial/ethnic minority individuals, lower rates of ART adherence and viral suppression persist, especially among Black men who have sex with men (BMSM) compared with their White counterparts. Black men who have sex with men living with HIV (BMSM+) residing in Los Angeles County (N = 124) were recruited in-person (eg, clinic) and online (eg, social networking apps). Participants completed a cross-sectional survey measuring demographic characteristics, structural syndemics (poverty, criminal justice involvement, and housing instability), and psychosocial syndemics (mental health and substance use). A text message survey assessed missed doses of ART over the past week. Zero-inflated Poisson regression models were used to evaluate variables associated with the number of missed doses of ART. On average, participants missed 1.30 doses of ART (SD = 2.09) and reported structural syndemics: poverty (56.1%), criminal justice involvement (36.6%), housing instability (26.3%), and psychosocial syndemics: childhood sexual abuse (51.8%), intimate partner violence (16.9%), depression (39%), and problem alcohol use (15.5%). After controlling for employment, age, education, and psychosocial syndemics, participants with a one-point increase in structural syndemic indicators were found to be 1.63 times more likely to have missed a dose of ART. Structural syndemic were associated with ART nonadherence among BMSM+ after adjusting for demographic and psychosocial factors. HIV treatment interventions that incorporate financial incentives, legal support, and housing may help improve ART adherence among BMSM+. Findings suggest that key priorities to ending the HIV epidemic must include structural interventions that alleviate poverty, eliminate disproportionate policing and criminalization, and end homelessness.","Journal of acquired immune deficiency syndromes (1999)","{""Holloway, Ian W"",""Beltran, Raiza"",""Shah, Saanchi V"",""Cordero, Luisita"",""Garth, Gerald"",""Smith, Terry"",""Wilson, Bianca D M"",""Ochoa, Ayako M""}","{N/A}","2021-12"
34757990,"Uptake, Retention, and Adherence to Pre-exposure Prophylaxis (PrEP) in TRIUMPH: A Peer-Led PrEP Demonstration Project for Transgender Communities in Oakland and Sacramento, California.","TRIUMPH (Trans Research-Informed communities United in Mobilization for the Prevention of HIV) was a community-led, transgender-specific pre-exposure prophylaxis (PrEP) demonstration project at 2 community-based clinical sites in California. TRIUMPH used peer health education, community mobilization, and clinical integration of PrEP with hormone therapy to promote PrEP knowledge and acceptability. The goal of this study was to evaluate PrEP uptake, retention, and adherence among TRIUMPH participants and examine site-based differences. Eligible participants were adult transgender and gender diverse people interested in PrEP. Participants were seen at baseline and at 1, 3, 6, 9, and 12 months for PrEP provision, clinical visits, and HIV testing. PrEP uptake was defined as dispensation of PrEP, PrEP retention was defined as proportion of expected visits completed among those who initiated PrEP, and PrEP adherence was assessed by measuring tenofovir diphosphate concentrations in dried blood spots. Logistic regression models quantified the association of variables with PrEP outcomes. TRIUMPH enrolled 185 participants; the median age was 28 years (interquartile range: 23-35), 7% was Black, and 58% was Latinx. PrEP uptake was as follows: 78% in Oakland and 98% in Sacramento; 91% among trans women, 96% among trans men, and 70% among nonbinary participants. Almost half (47%) rarely/never believed about HIV, and 42% reported condomless sex act in the past 3 months. Participants who reported higher numbers of sex partners were more likely to be retained and adherent; other predictors of adherence included not having a primary partner and not experiencing violence in the past 3 months. This community-led, trans-specific PrEP demonstration project documents high levels of PrEP initiation in a young transgender and gender diverse cohort at risk of HIV acquisition.","Journal of acquired immune deficiency syndromes (1999)","{""Sevelius, Jae M"",""Glidden, David V"",""Deutsch, Madeline"",""Welborn, Layla"",""Contreras, Alejandro"",""Salinas, Arianna"",""Venegas, Luz"",""Grant, Robert M""}","{N/A}","2021-12"
